Protein id	Contig id	Start	Stop	Strand	Element symbol	Element name	Scope	Type	Subtype	Class	Subclass	Method	Target length	Reference sequence length	% Coverage of reference	% Identity to reference	Alignment length	Closest reference accession	Closest reference name	HMM accession	HMM description
NA	NZ_CP118835.1	39203	41206	-	mecA	PBP2a family beta-lactam-resistant peptidoglycan transpeptidase MecA	core	AMR	AMR	BETA-LACTAM	METHICILLIN	EXACTX	668	668	100.00	100.00	668	WP_000721310.1	PBP2a family beta-lactam-resistant peptidoglycan transpeptidase MecA	NA	NA
NA	NZ_CP118835.1	41306	42280	+	mecR1	beta-lactam sensor/signal transducer MecR1	core	AMR	AMR	BETA-LACTAM	METHICILLIN	PARTIALX	325	585	55.56	100.00	325	WP_000952923.1	beta-lactam sensor/signal transducer MecR1	NA	NA
NA	NZ_CP118835.1	2375748	2376059	+	fosB	FosB/FosD family fosfomycin resistance bacillithiol transferase	core	AMR	AMR	FOSFOMYCIN	FOSFOMYCIN	PARTIALX	104	139	74.82	99.04	104	WP_000920239.1	FosB/FosD family fosfomycin resistance bacillithiol transferase	NA	NA
NA	NZ_CP118836.1	16421	17263	-	blaZ	penicillin-hydrolyzing class A beta-lactamase BlaZ	core	AMR	AMR	BETA-LACTAM	BETA-LACTAM	EXACTX	281	281	100.00	100.00	281	WP_000733289.1	penicillin-hydrolyzing class A beta-lactamase BlaZ	NA	NA
NA	NZ_CP118836.1	17370	19124	+	blaR1	beta-lactam sensor/signal transducer BlaR1	core	AMR	AMR	BETA-LACTAM	BETA-LACTAM	BLASTX	585	585	100.00	95.56	585	WP_001096386.1	beta-lactam sensor/signal transducer BlaR1	NA	NA
NA	NZ_CP118836.1	19117	19494	+	blaI	penicillinase repressor BlaI	core	AMR	AMR	BETA-LACTAM	BETA-LACTAM	BLASTX	126	126	100.00	99.21	126	WP_001284656.1	penicillinase repressor BlaI	NA	NA
