Protein id	Contig id	Start	Stop	Strand	Element symbol	Element name	Scope	Type	Subtype	Class	Subclass	Method	Target length	Reference sequence length	% Coverage of reference	% Identity to reference	Alignment length	Closest reference accession	Closest reference name	HMM accession	HMM description
NA	NZ_CP016856.1	473936	474778	-	blaZ	penicillin-hydrolyzing class A beta-lactamase BlaZ	core	AMR	AMR	BETA-LACTAM	BETA-LACTAM	BLASTX	281	281	100.00	94.66	281	WP_000733281.1	penicillin-hydrolyzing class A beta-lactamase BlaZ	NA	NA
NA	NZ_CP016856.1	476632	477009	+	blaI	penicillinase repressor BlaI	core	AMR	AMR	BETA-LACTAM	BETA-LACTAM	INTERNAL_STOP	126	126	100.00	92.86	126	WP_001284656.1	penicillinase repressor BlaI	NA	NA
NA	NZ_CP016856.1	1793098	1793514	-	fosB	FosB/FosD family fosfomycin resistance bacillithiol transferase	core	AMR	AMR	FOSFOMYCIN	FOSFOMYCIN	BLASTX	139	139	100.00	99.28	139	WP_000920239.1	FosB/FosD family fosfomycin resistance bacillithiol transferase	NA	NA
NA	NZ_CP016856.1	2169930	2170772	-	blaZ	penicillin-hydrolyzing class A beta-lactamase BlaZ	core	AMR	AMR	BETA-LACTAM	BETA-LACTAM	BLASTX	281	281	100.00	94.66	281	WP_000733281.1	penicillin-hydrolyzing class A beta-lactamase BlaZ	NA	NA
NA	NZ_CP016856.1	2172626	2173003	+	blaI	penicillinase repressor BlaI	core	AMR	AMR	BETA-LACTAM	BETA-LACTAM	BLASTX	126	126	100.00	96.03	126	WP_001284656.1	penicillinase repressor BlaI	NA	NA
NA	NZ_CP016856.1	2242858	2245783	+	23S_T2532C	Staphylococcus aureus linezolid resistant 23S	core	AMR	POINT	OXAZOLIDINONE	LINEZOLID	POINTN	2926	2926	100.00	99.86	2926	NZ_CP009828.1:497114-500039	23S ribosomal RNA	NA	NA
