Protein id	Contig id	Start	Stop	Strand	Element symbol	Element name	Scope	Type	Subtype	Class	Subclass	Method	Target length	Reference sequence length	% Coverage of reference	% Identity to reference	Alignment length	Closest reference accession	Closest reference name	HMM accession	HMM description
NA	NZ_CP138455.2	6488	9148	+	gyrA_S84L	Staphylococcus aureus quinolone resistant GyrA	core	AMR	POINT	QUINOLONE	QUINOLONE	POINTX	887	887	100.00	99.77	887	WP_000819084.1	DNA gyrase subunit A GyrA	NA	NA
NA	NZ_CP138455.2	39219	41222	-	mecA	PBP2a family beta-lactam-resistant peptidoglycan transpeptidase MecA	core	AMR	AMR	BETA-LACTAM	METHICILLIN	EXACTX	668	668	100.00	100.00	668	WP_000721309.1	PBP2a family beta-lactam-resistant peptidoglycan transpeptidase MecA	NA	NA
NA	NZ_CP138455.2	41322	42296	+	mecR1	beta-lactam sensor/signal transducer MecR1	core	AMR	AMR	BETA-LACTAM	METHICILLIN	PARTIALX	325	585	55.56	100.00	325	WP_000952923.1	beta-lactam sensor/signal transducer MecR1	NA	NA
NA	NZ_CP138455.2	520473	523393	+	23S_C2220T	Staphylococcus aureus linezolid resistant 23S	core	AMR	POINT	OXAZOLIDINONE	LINEZOLID	POINTN	2921	2926	99.97	99.69	2925	NZ_CP009828.1:497114-500039	23S ribosomal RNA	NA	NA
NA	NZ_CP138455.2	1322089	1324488	+	parC_S80F	Staphylococcus aureus quinolone resistant ParC	core	AMR	POINT	QUINOLONE	QUINOLONE	POINTX	800	800	100.00	99.12	800	WP_001289586.1	DNA topoisomerase IV subunit A ParC	NA	NA
NA	NZ_CP138455.2	1411664	1412140	-	dfrB_A135T	Staphylococcus aureus trimethoprim resistant DfrB	core	AMR	POINT	TRIMETHOPRIM	TRIMETHOPRIM	POINTX	159	159	100.00	98.11	159	WP_000175752.1	dihydrofolate reductase DfrB	NA	NA
NA	NZ_CP138455.2	2009510	2009887	-	blaI	penicillinase repressor BlaI	core	AMR	AMR	BETA-LACTAM	BETA-LACTAM	BLASTX	126	126	100.00	96.03	126	WP_001284656.1	penicillinase repressor BlaI	NA	NA
NA	NZ_CP138455.2	2011741	2012583	+	blaZ	penicillin-hydrolyzing class A beta-lactamase BlaZ	core	AMR	AMR	BETA-LACTAM	BETA-LACTAM	BLASTX	281	281	100.00	94.66	281	WP_000733281.1	penicillin-hydrolyzing class A beta-lactamase BlaZ	NA	NA
NA	NZ_CP138456.2	78	809	+	erm(C)	23S rRNA (adenine(2058)-N(6))-methyltransferase Erm(C)	core	AMR	AMR	LINCOSAMIDE/MACROLIDE/STREPTOGRAMIN	CLINDAMYCIN/ERYTHROMYCIN/STREPTOGRAMIN B/TYLOSIN	EXACTX	244	244	100.00	100.00	244	WP_001003263.1	23S rRNA (adenine(2058)-N(6))-methyltransferase Erm(C)	NA	NA
