Protein id	Contig id	Start	Stop	Strand	Element symbol	Element name	Scope	Type	Subtype	Class	Subclass	Method	Target length	Reference sequence length	% Coverage of reference	% Identity to reference	Alignment length	Closest reference accession	Closest reference name	HMM accession	HMM description
NA	NZ_CP138864.1	46947	48950	-	mecA	PBP2a family beta-lactam-resistant peptidoglycan transpeptidase MecA	core	AMR	AMR	BETA-LACTAM	METHICILLIN	EXACTX	668	668	100.00	100.00	668	WP_000721306.1	PBP2a family beta-lactam-resistant peptidoglycan transpeptidase MecA	NA	NA
NA	NZ_CP138864.1	1425244	1425720	-	dfrB_A135T	Staphylococcus aureus trimethoprim resistant DfrB	core	AMR	POINT	TRIMETHOPRIM	TRIMETHOPRIM	POINTX	159	159	100.00	98.11	159	WP_000175752.1	dihydrofolate reductase DfrB	NA	NA
NA	NZ_CP138864.1	2018157	2018534	-	blaI	penicillinase repressor BlaI	core	AMR	AMR	BETA-LACTAM	BETA-LACTAM	BLASTX	126	126	100.00	94.44	126	WP_001284656.1	penicillinase repressor BlaI	NA	NA
NA	NZ_CP138864.1	2020388	2021230	+	blaZ	penicillin-hydrolyzing class A beta-lactamase BlaZ	core	AMR	AMR	BETA-LACTAM	BETA-LACTAM	BLASTX	281	281	100.00	94.66	281	WP_000733281.1	penicillin-hydrolyzing class A beta-lactamase BlaZ	NA	NA
NA	NZ_CP138865.1	1292	2023	+	erm(C)	23S rRNA (adenine(2058)-N(6))-methyltransferase Erm(C)	core	AMR	AMR	LINCOSAMIDE/MACROLIDE/STREPTOGRAMIN	CLINDAMYCIN/ERYTHROMYCIN/STREPTOGRAMIN B/TYLOSIN	EXACTX	244	244	100.00	100.00	244	WP_001003263.1	23S rRNA (adenine(2058)-N(6))-methyltransferase Erm(C)	NA	NA
