Protein id	Contig id	Start	Stop	Strand	Element symbol	Element name	Scope	Type	Subtype	Class	Subclass	Method	Target length	Reference sequence length	% Coverage of reference	% Identity to reference	Alignment length	Closest reference accession	Closest reference name	HMM accession	HMM description
NA	NZ_CP113052.1	281601	282863	-	murA_G257D	Staphylococcus aureus fosfomycin resistant MurA	core	AMR	POINT	FOSFOMYCIN	FOSFOMYCIN	POINTX	421	421	100.00	99.76	421	WP_000358006.1	UDP-N-acetylglucosamine 1-carboxyvinyltransferase MurA	NA	NA
NA	NZ_CP113052.1	515441	515857	+	fosB	FosB/FosD family fosfomycin resistance bacillithiol transferase	core	AMR	AMR	FOSFOMYCIN	FOSFOMYCIN	EXACTX	139	139	100.00	100.00	139	WP_000920239.1	FosB/FosD family fosfomycin resistance bacillithiol transferase	NA	NA
NA	NZ_CP113052.1	942807	945467	+	gyrA_S84L	Staphylococcus aureus quinolone resistant GyrA	core	AMR	POINT	QUINOLONE	QUINOLONE	POINTX	887	887	100.00	99.77	887	WP_000819084.1	DNA gyrase subunit A GyrA	NA	NA
NA	NZ_CP113052.1	974905	976908	-	mecA	PBP2a family beta-lactam-resistant peptidoglycan transpeptidase MecA	core	AMR	AMR	BETA-LACTAM	METHICILLIN	EXACTX	668	668	100.00	100.00	668	WP_000721310.1	PBP2a family beta-lactam-resistant peptidoglycan transpeptidase MecA	NA	NA
NA	NZ_CP113052.1	977008	977982	+	mecR1	beta-lactam sensor/signal transducer MecR1	core	AMR	AMR	BETA-LACTAM	METHICILLIN	PARTIALX	325	585	55.56	100.00	325	WP_000952923.1	beta-lactam sensor/signal transducer MecR1	NA	NA
NA	NZ_CP113052.1	2328159	2330558	+	parC_S80Y	Staphylococcus aureus quinolone resistant ParC	core	AMR	POINT	QUINOLONE	QUINOLONE	POINTX	800	800	100.00	99.50	800	WP_001289586.1	DNA topoisomerase IV subunit A ParC	NA	NA
