Protein id	Contig id	Start	Stop	Strand	Element symbol	Element name	Scope	Type	Subtype	Class	Subclass	Method	Target length	Reference sequence length	% Coverage of reference	% Identity to reference	Alignment length	Closest reference accession	Closest reference name	HMM accession	HMM description
NA	NZ_CP087437.1	39691	40092	-	bleO	bleomycin binding protein	core	AMR	AMR	BLEOMYCIN	BLEOMYCIN	EXACTX	134	134	100.00	100.00	134	WP_001242578.1	bleomycin binding protein	NA	NA
NA	NZ_CP087437.1	40312	41070	-	aadD1	aminoglycoside O-nucleotidyltransferase ANT(4')-Ia	core	AMR	AMR	AMINOGLYCOSIDE	KANAMYCIN/TOBRAMYCIN	EXACTX	253	253	100.00	100.00	253	WP_001014230.1	aminoglycoside O-nucleotidyltransferase ANT(4')-Ia	NA	NA
NA	NZ_CP087437.1	43528	45531	-	mecA	PBP2a family beta-lactam-resistant peptidoglycan transpeptidase MecA	core	AMR	AMR	BETA-LACTAM	METHICILLIN	EXACTX	668	668	100.00	100.00	668	WP_000721310.1	PBP2a family beta-lactam-resistant peptidoglycan transpeptidase MecA	NA	NA
NA	NZ_CP087437.1	45631	46605	+	mecR1	beta-lactam sensor/signal transducer MecR1	core	AMR	AMR	BETA-LACTAM	METHICILLIN	PARTIALX	325	585	55.56	100.00	325	WP_000952923.1	beta-lactam sensor/signal transducer MecR1	NA	NA
NA	NZ_CP087437.1	1376597	1378996	+	parC_S80F	Staphylococcus aureus quinolone resistant ParC	core	AMR	POINT	QUINOLONE	QUINOLONE	POINTX	800	800	100.00	99.50	800	WP_001289586.1	DNA topoisomerase IV subunit A ParC	NA	NA
NA	NZ_CP087437.1	2001879	2002256	-	blaI	penicillinase repressor BlaI	core	AMR	AMR	BETA-LACTAM	BETA-LACTAM	BLASTX	126	126	100.00	96.03	126	WP_001284656.1	penicillinase repressor BlaI	NA	NA
NA	NZ_CP087437.1	2004110	2004952	+	blaZ	penicillin-hydrolyzing class A beta-lactamase BlaZ	core	AMR	AMR	BETA-LACTAM	BETA-LACTAM	BLASTX	281	281	100.00	94.66	281	WP_000733281.1	penicillin-hydrolyzing class A beta-lactamase BlaZ	NA	NA
NA	NZ_CP087437.1	2384561	2384977	+	fosB	FosB/FosD family fosfomycin resistance bacillithiol transferase	core	AMR	AMR	FOSFOMYCIN	FOSFOMYCIN	BLASTX	139	139	100.00	99.28	139	WP_000920239.1	FosB/FosD family fosfomycin resistance bacillithiol transferase	NA	NA
